country,city,address_1,reason_for_recall,address_2,product_quantity,code_info,center_classification_date,distribution_pattern,state,product_description,report_date,classification,openfda,recalling_firm,recall_number,initial_firm_notification,product_type,event_id,termination_date,recall_initiation_date,postal_code,voluntary_mandated,status,more_code_info,datetime_report_date
United States,Wheeling,120 W Palatine Rd,This voluntary recall has been initiated because the Trader Joe's Egg White Salad with Chives tested positive for Listeria monocytogenes.,,304 - 6oz. containers,The lot code is SELL BY JUN 10 2014  The UPC code is 00666695,20140707,US: (IL),IL,"Egg White Salad with Chives, 6 oz., packaged in round plastic containers with film seals and snap lids under the Trader Joe's brand. This is a ready-to-eat refrigerated deli salad sold at retail locations.",20140716,Class I,{},Hot Mama's Foods,F-2082-2014,E-Mail,Food,68515,20180530,20140606,60090-5823,Voluntary: Firm Initiated,Terminated,,2014-07-16
United States,Saint Cloud,1921 Coborn Blvd,"While reviewing the allergen listings for our products and cross referencing against the updated spec sheet from the manufacturer of the bread base, it was discovered that the allergen statement had been updated from only wheat to wheat, milk, egg and soy.",,121 loaves (total),Sell by 9/7/2017,20170929,"Coborn's, Marketplace, and Cashwise stores in MN, WI, ND, and SD.",MN,Coborn's/Cash Wise Caraway Rye Bread - UPC 7-33147-20155-8  Net Wt. 16 oz (1.0 lb) (454 g)  Sell by 9/6/2017,20171011,Class II,{},"Coborn's, Inc",F-3611-2017,"Two or more of the following: Email, Fax, Letter, Press Release, Telephone, Visit",Food,78089,20190815,20170906,56301,Voluntary: Firm initiated,Terminated,,2017-10-11
United States,Sterling,22445 Sous Vide Ln,Undeclared egg and milk,,4633 cases,"82530, 82625, 82769, and 83367",20210625,Distributed nationwide,VA,"JUST Egg Inspired by America Roasted Potato, Dill, Chives, Red Bell Pepper, Black Pepper 4 Sous Vide Plant Egg Bites NET WT8.4OZ (238g). UPC: 0504402503, Expiration dates 2/22/2022, 3/1/2022, 3/8/2022,  2/22/2022, and 4/6/2022. 16 cartons per corrugated case, Carton GTIN 7 05044 02503 2, Case Bar Code 10 7050 440 25039",20210707,Class II,{},Cuisine Solutions,F-0743-2021,E-Mail,Food,88143,20220330,20210618,20166-9382,Voluntary: Firm initiated,Terminated,,2021-07-07
United States,Brisbane,99 Park Ln,Labeling for Croissants and Chocolate Croissants fails to declare  egg in the ingredients list or allergen information. The croissants are manufactured with an egg wash.,,565 croissants,Packed on dates of 8/16/16 or earlier and best by dates of 8/18/16 or earlier,20160915,CA  Bay area only,CA,"Chocolate Croissant;  Sold in self service case labeled ""Chocolate Croissant""  PLU 481976 or clam shell package of 4 - PLU 241595.    Ingredient: Water, Wheat Flour, Sugar Butter (Pasteurized Cream, Salt), Milk (Powder Fat Whole), Semisweet Chocolate Chips, Eggs, Salt, Yeast, Ascorbic Acid.  Contains Wheat, Milk    Whole Foods Market, Emeryville, CA",20160921,Class I,{},"Bakers Of Paris, Inc.",F-2241-2016,E-Mail,Food,74946,20160915,20160816,94005-1309,Voluntary: Firm initiated,Terminated,,2016-09-21
United States,Kent,8030 S 228th St,"Real Foods of Seattle, LLC discovered that the wrong dressing was added to the package of strawberries.  The wrong dressing contains egg and soy, which is not declared on the product packaging.",Bldg A,356 cases (2ea/case),Use By 02/16/15    UPC 0 45009 06411 0    Item # 028-06411,20150310,"Two distribution centers.  One in Portland, OR and one in Seattle, WA.  These distributors further distributed to local grocery chains in OR and WA.",WA,"Product labeling is on the bottom of the container.  Label reads in part ""SMALL HEART STRAWBERRY TRAY WITH DEVONSHIRE DIP***Use By: 02/16/15 Net Weight 1.5# ***KEEP REFRIGERATED***""    Product is packaged in a non flex plastic heart shaped container which is pink on the bottom and clear on the top.  The container of dressing is visible through the clear plastic top.",20150318,Class I,{},"Real Foods of Seattle, LLC",F-1410-2015,Telephone,Food,70511,20150323,20150210,98032-2987,Voluntary: Firm initiated,Terminated,,2015-03-18
United States,Lorida,1807 Us Highway 98,"Undeclared major allergens (egg and soy) in  ""Captain Rusty's"" brand Smoked Mahi Dip uncovered during FDACS routine inspection.",,unknown,"lot code/expiration date:  1999-6/1/20, 2002-6/6/20, 2009-6/13/20, 2010-6/14/20, 2011-6/16/20, 2017-6/17/20, 2019-6/21/20",20200616,Domestic distribution only.,FL,"Captain Rusty's Smoked Mahi Dip, Made with real Mahi  meat, Keep Refrigerated, 6 lb.",20200624,Class I,{},Captain Rusty's Seafood Products LLC,F-0995-2020,"Two or more of the following: Email, Fax, Letter, Press Release, Telephone, Visit",Food,85788,20201103,20200521,33857-9774,Voluntary: Firm initiated,Terminated,,2020-06-24
United States,Rochester,1500 Brooks Ave,The product is labeled as Thai Chili Sauce. The product actually contains Spicy Sauce which contains undeclared egg.,,31 units,Best By Date: 3/9/2018 to 3/12/2018,20180326,"Wegmans Stores in NY, NJ, PA, VA, MD and MA.",NY,"Wegmans Assorted Gyoza (Dumplings), Family Pack, 17 oz.   UPC: 2-48798-00000 or 2-48963-00000 packaged with Wegmans Thai Sweet Chili Sauce Cup 1.5 oz. (UPC7-66630-98023)",20180404,Class I,{},"Wegmans Food Markets, Inc.",F-0970-2018,"Two or more of the following: Email, Fax, Letter, Press Release, Telephone, Visit",Food,79492,20180327,20180310,14624-3512,Voluntary: Firm initiated,Terminated,,2018-04-04
United States,Seattle,4301 University Way Ne,Ice cream grab n go Cup containers' labels do not declare any ingredients including allergens Egg and Milk.,,8 cups,No manufacturing code & expiration dates range from 7/30/2023 to 8/21/2023.,20230808,Distributed in WA only.,WA,"Sweet Alchemy Lemon Custard ice cream, distributed in cups. Label declares company name, flavor name, but does not declare ingredients and allergens.",20230816,Class II,{},"Sweet Alchemy Ice Creamery, Inc",F-1387-2023,E-Mail,Food,92649,20230911,20230630,98105-5808,Voluntary: Firm initiated,Terminated,,2023-08-16
United States,Emeryville,5980 Horton St Ste 200,Egg wash is used on the product and is not listed on the ingredient list or allergen statement.,,~110-120 units per week. 19 weeks of product - 2280 total units,All units with sell by date prior to 8/14/13 and pack date prior to 8/10/13.,20130828,Northern CA and one location in NV,CA,"Blueberry Crostata, 1 pie  Net. Wt. 1 lb. 6 oz (624 g)    UPC: 0216733009993    Whole Foods Market Inc., Emeryville, CA 94608",20130904,Class I,{},Whole Foods Market,F-1857-2013,E-Mail,Food,66001,20130829,20130810,946082057,Voluntary: Firm initiated,Terminated,,2013-09-04
United States,Bethesda,6905 Rockledge Dr,Ultra Tuna Salad in a Cup label does not declare egg.,,19 cups,Expiration date: 5/3/23.,20230523,distributed in WA.,MD,"Ultra Tuna Salad Cup, brand DishD'Lish, packaged in  plastic cup.  Label declares Housemade Albacore Tuna Salad, Arugula, Cucumber and Cherry Tomatoes.",20230531,Class I,{},Hms Host International Inc,F-0931-2023,Other,Food,92280,20230525,20230503,20817-1828,Voluntary: Firm initiated,Terminated,,2023-05-31
United States,Berkeley,2001 Addison St Ste 300,Affected lots of Vegan Shoyu Ramen meal kits used egg noodles which contain egg. The allergen of egg is not listed on the product label.,,1416 units,Lot #0522047 and lot#0522027 on the back and with an expiration date of 10/27/2022 and 11/16/2022 printed on the back.,20220510,E-commerce sales and to 3 retail locations in CA and NY,CA,"Ramen Hero - Vegan Shoyu ramen (Hippie Van) Ramen noodles in a soy sauce infused vegan broth with a vegan meat ragu, roasted tomato, bell pepper and zucchini blend, and seaweed. Kits are in a frosted meal kit stand up pouch.    Net Wt. 20.05 oz. (1.25 lb.) 568 g    UPC: 60003    Contains: Soy, Treenut (coconut) Wheat, Sulfites.    Distributed by: Ramen Hero, 2001 Addison St. Suite 300, Berkeley, CA 94704",20220518,Class I,{},Ramen Hero,F-1057-2022,Telephone,Food,90010,20220629,20220412,94704-1165,Voluntary: Firm initiated,Terminated,,2022-05-18
United States,Linden,710 West Linden Avenue,The firm's Pista Khatie cookies with use by date 16 May 14 were tested by the Canadian Food Inspection Agency (CFIA) and found to contain 70 ppm of undeclared egg allergen. The label for this product states that it does not contain eggs.,,24 cases x 12 plastic clam shell boxes; 15 cases x  13 clam shel boxes,Use By Date: 16 May 14; 13 oz. package UPC Code: 12042 00129; 30 oz. package UPC Code: 12042 00296,20131107,"CA, Canada",NJ,"KCB Pista Khatie  KCB Bakery Products Corp.  56-28 56th Street, Maspeth, NY 11378  Tel: (718) 786-9463 Fax (718) 361-0171  www.kbcusa.com    a) Net Wt. 30 OZ (850 G)    b) Net Wt. 13 OZ (369 G)    Packaged in a plastic clam shell container with stick-on labels.",20131113,Class I,{},Kashmir Crown Baking LLC,F-0121-2014,"Two or more of the following: Email, Fax, Letter, Press Release, Telephone, Visit",Food,66579,20160419,20131017,07036,Voluntary: Firm initiated,Terminated,,2013-11-13
United States,Austin,601 N Lamar Blvd Ste 300,Undeclared milk and egg,,8 units,Packed on 9/2/21; Best by 9/5/2021,20210916,Georgia,TX,"Whole Foods Market - Vegan Croissant 4 Count CONTAINS WHEAT, SOY May contain other allergens due to shared production areas, NET WT 0lb 11oz (312g) PLU 69435 packaged in clear plastic container",20210922,Class I,{},"Whole Foods Market Brand 365, Llc",F-0985-2021,E-Mail,Food,88632,20211208,20210903,78703-5424,Voluntary: Firm initiated,Terminated,,2021-09-22
United States,Austin,550 Bowie St,Potential to contain undeclared egg,,580.91units (total of all products),Best by dates through 10/28/2020,20201124,"Maryland, New Jersey, Pennsylvania, Virginia and Washington, D.C.",TX,"Chicken Rustico Romano Chef Plate with Mac & Cheese and Broccoli, packaged in clear plastic container with printed label product code begins with 241442",20201202,Class I,{},Whole Foods Market,F-0133-2021,"Two or more of the following: Email, Fax, Letter, Press Release, Telephone, Visit",Food,86682,20201204,20201027,78703-4644,Voluntary: Firm initiated,Terminated,,2020-12-02
United States,Houston,2777 Allen Pkwy,Undeclared egg.  One lot Ronzoni Thin Spaghetti contained Ronzoni Egg Fettuccine.,,7320 units,Code:  JAN 20 19 K,20170417,PA and FL,TX,"Ronzoni(R) Thin Spaghetti, NO. 9, ENRICHED MACARONI PRODUCT, NET WT 16 OA (454g)., UPC 71300 00009",20170426,Class I,{},"Riviana International, Inc",F-1965-2017,"Two or more of the following: Email, Fax, Letter, Press Release, Telephone, Visit",Food,76788,20170822,20170317,77019-2107,Voluntary: Firm initiated,Terminated,,2017-04-26
United States,Austin,550 Bowie St,Undeclared lysozyme (from egg whites),,43 lbs,"Sell by dates: until September 11, 2020",20200901,Nationwide throughout the United States,TX,Whole Foods Market Mitica La Dama Sagrada Raw Milk - Aged 60 Days or More PLU  20656400000 Individual sliced cheese wrapped in plastic wrap with scale label on top.,20200909,Class I,{},Whole Foods Market,F-1357-2020,E-Mail,Food,86252,20201103,20200810,78703-4644,Voluntary: Firm initiated,Terminated,,2020-09-09
United States,Harrisburg,7505 Grayson Rd,"Undeclared allergens (milk, wheat, fish (anchovy) and egg.",,100 cases x 6 bags (600/9.oz bags),Lot # H34711A and H34711B  product of USA,20170113,"One distributor - Lancaster Foods, Jessup, Maryland",PA,"Fresh Express Hearts of Romaine salad, 9 oz., clear/labeled salad bag/ 6 bags per case",20170125,Class I,{},"Fresh Express, Inc.",F-1260-2017,"Two or more of the following: Email, Fax, Letter, Press Release, Telephone, Visit",Food,76057,20170912,20161221,17111-5146,Voluntary: Firm initiated,Terminated,,2017-01-25
United States,Inver Grove Heights,6085 Claude Way,undeclared egg,,380 units,Sell by 9/30/20 thru 11/2/20,20201123,"CO, KS, NM, SD, WY",MN,"J&O Mixed Veggie Cup with Dip, Net Weight 5.0 oz. (128 g), UPC  95631-85818.  Mfg By:  RDW, Pueblo CO 81001",20201118,Class I,{},"Russ Davis Wholesale, LLC",F-0127-2021,"Two or more of the following: Email, Fax, Letter, Press Release, Telephone, Visit",Food,86677,20201125,20201028,55076-4432,Voluntary: Firm initiated,Terminated,,2020-11-18
United States,Springfield,1133 E Kearney St,"The firm has received complaints of an egg nog flavor in half gallons of chocolate milk. Egg nog is manufactured at the same plant. The egg nog contains egg ingredients, but the chocolate milk does not declare egg on the label.",,"1,151 half-gallons","UPC: 0-7206000128-0   Sell by Date: Dec 13, 2018   Plant Code: 29-162    Best by 12/13/18",20190222,"Distributed to grocery stores in the Kansas City, MO and suburbs on both sides of the state line. Product was also distributed to grocery stores in the St. Joseph, MO area.",MO,"Hiland Chocolate Milk, 1/2 gallon (1.89 L). Hiland Dairy Springfield, MO 65803",20190123,Class I,{},Hiland Dairy Foods Company LLC,F-1056-2019,Visit,Food,81701,20190304,20181203,65803-3435,Voluntary: Firm initiated,Terminated,,2019-01-23
United States,Seattle,4301 University Way Ne,Ice cream grab n go Pint and Cup containers' labels do not declare any ingredients including allergens Egg and Milk.,,4 pints and 6 cups,No manufacturing code & expiration dates range from 7/30/2023 to 8/21/2023.,20230808,Distributed in WA only.,WA,"Sweet Alchemy Vanilla Cubed ice cream, distributed in cups and pints. Label declares company name, flavor name, but does not declare ingredients and allergens.",20230816,Class II,{},"Sweet Alchemy Ice Creamery, Inc",F-1393-2023,E-Mail,Food,92649,20230911,20230630,98105-5808,Voluntary: Firm initiated,Terminated,,2023-08-16
United States,Seattle,4301 University Way Ne,"Ice cream grab n go Pint and Cup containers' labels do not declare any ingredients including allergens Egg, Milk, and Wheat.",,4 pints and 8 cups,No manufacturing code & expiration dates range from 7/30/2023 to 8/21/2023.,20230808,Distributed in WA only.,WA,"Sweet Alchemy Strawberry Rhubarb Crisp ice cream, distributed in cups and pints. Label declares company name, flavor name, but does not declare ingredients and allergens.",20230816,Class II,{},"Sweet Alchemy Ice Creamery, Inc",F-1390-2023,E-Mail,Food,92649,20230911,20230630,98105-5808,Voluntary: Firm initiated,Terminated,,2023-08-16
United States,Gardena,1650 W El Segundo Blvd,Undeclared allergen; egg.,,"1,594,338 units",BEST BEFORE JAN.15.2019 to BEST BEFORE NOV.21.2019,20190222,"U.S. distribution to the following: CA, WA, UT, IL, TX, NJ, GA, NV, CO, HI, OR, AZ    Foreign distribution to the following: Canada",CA,"Ottogi Ppushu Ppushu Grilled Chicken Flavor  3.17oz x 40ea  Item #21503006  Manufactured by: Ottogi Ramyon Co. Ltd.  Distributed by: Ottogi America, Inc. 1650 W. El Segundo Bl. Gardena, CA 90249",20190306,Class I,{},Ottogi America Inc,F-1067-2019,Letter,Food,81944,20190426,20190115,90249-2010,Voluntary: Firm initiated,Terminated,,2019-03-06
United States,Duluth,3245 N Berkeley Lake Rd Nw,Undeclared Allergen: Egg,,"48,143 cases/200 ct/9 gram pack per case","Product Code: 86251, Lot numbers: D009E, D022E, D027E, D030E, D031E, D037E, D038E, D048E, D056E, D057E, D058E, D093E, D105E, D136D, D150D, D156D, D162D, D163D, D171D, D172D, D178D, D190D, D193D, D199D, D204D, D213D, D220D, D224D, D227D, D228D, D229D, D234D, D235D, D241D, D248D, D249D, D252D, D254D, D255D, D266D, D267D, D274D, D275D, D281D, D282D, D295D, D298D, D302D, D315D, D316D, D318D, D322D, D329D, D338D, D339D, D344D, D345D, D361D; Product Code: 86242, Lot number: D022E, D037E, D065E, D105E, D169D, D171D, D184D, D189D, D193D, D199D, D203D, D204D, D220D, D233D, D234D, D240D, D256D, D269D, D274D, D280D, D283D, D294D, D315D, D329D, D331D, D351D, D358D, D360D; Product Code: 86228, Lot numbers: D009E, D022E, D027E, D038E, D048E, D058E, D136D, D162D, D184D, D193D, D199D, D204D, D220D, D224D, D227D, D228D, D235D, D241D, D248D, D249D, D254D, D266D, D267D, D280D, D283D, D298D, D315D, D316D, D322D, D329D, D345D, D346D.",20140611,"AR, CA, CO, FL, GA, IA, IN, KS, KY, MN, MS, NJ, NY, OH, OK, OR, TX, UT and VA.",GA,"Poco Pac Salad Dressing, Distributed by Diamond Crystal Brands, Inc., Savannah, GA 31405, and packaged in single serve packets of 9 or 12 grams (g) of product. Product is packed as follows: 500 ct-9g (Product Code: 86251), 200ct-9g (Product Code: 86242) and 200 ct-12g (Product Code: 86228).",20140618,Class I,{},"Diamond Crystal Brands, Inc.",F-2018-2014,Letter,Food,68306,20140820,20140514,30096-3054,Voluntary: Firm initiated,Terminated,,2014-06-18
United States,Houston,333 Northpark Central Dr,Undeclared egg,,2976 units,"Lot# 083747, 083757, 083767, 083777, 038748, 038758, 017598; UPC# 710779112841 and UPC# 710779113411",20180508,"Distributed nationwide throughout the US and the following countries - Vietnam,   Dom Republic, Kuwait, Panama, Saudi, Korea, Germany, Iceland, EU, Bermuda, Australia, Jordan",TX,"Lean Pro 8 Chocolate 2,268g (5lb) Tub and Lean Pro 8 Chocolate 1,000g (2.2lb) Tub",20180516,Class I,{},"Labrada Nutrition, Inc",F-1392-2018,"Two or more of the following: Email, Fax, Letter, Press Release, Telephone, Visit",Food,79958,20181019,20180424,77073-6336,Voluntary: Firm initiated,Terminated,,2018-05-16
United States,Portland,301 Se 2nd Ave,Product is recalled due to undeclared egg.,,35 pkg. crunch roll,Hand-Crafted Date of 6/15/2019 and Best by Date of 6/17/2019.,20190703,distributed in Oregon,OR,"Spicy Shrimp Tempura Crunch Roll, Mai brand, packed in container with clear plastic lid,net wt. 9.1 oz., UPC 8 12824 01526 5.    The label is read in parts: ""***MAI SPICY SHRIMP TEMPURA CRUNCH ROLL  ***KEEP REFRIGERATED***Allergen: SOY, WHEAT, SHELLFISH***""dist by Mai Sushi 2 Penn Center, Suite 725, 1500 JFK Blvd Philadelphia, PA***",20190703,Class I,{},Mai Cuisine LLC,F-1530-2019,"Two or more of the following: Email, Fax, Letter, Press Release, Telephone, Visit",Food,83157,20190719,20190616,97214,Voluntary: Firm initiated,Terminated,,2019-07-03
Korea (the Republic of),Seoul,3 104 Opaesan-ro,"Undeclared allergens of egg, milk, and wheat","Gil, Seongbuk-Gu","8,430 boxes (210,750 bottles)",Expiration date : prior to 8/31/2021,20210127,"NJ, WA, CA, MD, NY",,"Samyang Buldak Extremely Spicy Hot Chicken Flavor Sauce  Hot Chili Sauce  Net Wt. 200 g (7.05 oz)  Product of Korea  UPC: 8 801073 411395    Ingredients: Water, Artificial chicken flavor powder (artificial flavor, dextrin, sugar, red pepper powder, yeast powder, chili pepper powder, modified potato starch, egg, curry powder [turmeric powder, dextrin, salt, milk]), Corn syrup, Artificial flavor, Soy sauce (soy, water, salt, wheat, high fructose corn syrup), Soybean oil, Onion, Garlic, Decolorized chili extract, Paprika extract, Lactobacillus fermented powder, Green tea flavor oil (water, polyglycerin fatty acid ester, tea catechin, dextrin)  Allergen: Egg, Milk, Soy, Wheat  (Missing allergens declared from the label: egg, milk, and wheat)      Manufactured by: Samyang Foods Co. Ltd. Seoul, Korea",20210203,Class II,{},Samyang Foods Co Ltd,F-0237-2021,E-Mail,Food,87162,20210615,20210114,,Voluntary: Firm initiated,Terminated,,2021-02-03
United States,Bayonne,100 Pulaski St,The recall was initiated after it was discovered the label failed to list the common name Albumin as egg; also the species of fish was not declared in the ingredient statement.,,Unknown,All lots,20130517,New York,NJ,"Lam Sheng Kee, Frozen White Fish Ball - Fresh Fish Cake, Net Weight 7 oz (200 G) - Sheng Lin Mark Trade Co. LTD 4 F. No 89, Ln. 528 Heping Road, Bade City, Taoyuan County 334, Taiwan (ROC).  Distributed by: Win Luck Trading Inc. 100 Pulaski Street, Bayonne, NJ  07002.    UPC 6949682804589",20130529,Class I,{},Win Luck Trading Inc,F-1440-2013,Letter,Food,64916,20150302,20130325,07002-5003,Voluntary: Firm initiated,Terminated,,2013-05-29
United States,Corsica,280 E. Main Street,Sandwiches contain undeclared egg and milk.,,2000 sandwiches,Sandwiches dated 12/7/2021 thru 1/12/2022,20211222,"IA, MN, ND, SD",SD,"Dakota Tom's and Market Fresh branded Chicken Salad Croissant sandwiches.  Net Wt. 6.5 oz. UPC 37296-10100, Dakota Toms, Box  271, Corsica, SD  57328.",20211229,Class I,{},"Dakota Tom's, Inc",F-0350-2022,"Two or more of the following: Email, Fax, Letter, Press Release, Telephone, Visit",Food,89175,,20211207,57328,Voluntary: Firm initiated,Ongoing,,2021-12-29
United States,Louisville,185 S 104th St,Izzio Artisan Bakery is voluntarily recalling a particular lot of Lemon Poppy Muffins because the product is undercooked and may contain undercooked egg.,,"340 cases (30,600 individual muffins)","Lot # 14286, Exp 04/11/2015",20150304,"Distributed to one customer/distributor with receiving locations in CO, NJ and MD. No foreign/military/govt/VA.",CO,Izzio Artisan Bakery Rev Lem/Poppy Muffins 3.5oz packaged individually and put into cardboard case with 90 muffins per case,20150311,Class II,{},"Izzio Artisan Bakery, LLC",F-1382-2015,Telephone,Food,70437,20150702,20150202,80027-9736,Voluntary: Firm initiated,Terminated,,2015-03-11
United States,Farmers Branch,4436 Mcewen Rd,Potential to contain undeclared egg,,471 cases,Lot# 20310-07 and 20307-07,20210326,"Chicago, IL",TX,"UnTortillas Grain Free * 3 g of non-fibre carbs * 210g 6 tortillas per bag, 8 packages per case.  UPC# 40628250179024 packaged in flexible plastic",20210407,Class II,{},BakeryWorks LLC,F-0354-2021,Letter,Food,87478,20211206,20210218,75244-5205,Voluntary: Firm initiated,Terminated,,2021-04-07
United States,Cincinnati,1014 Vine St,Undeclared egg allergen for Chipotle Crema on product label.,,"5,387 units.",All products purchased prior to 05/25/2021.,20210615,"Distributed to UT, NM, NV, AZ, WY, MT, ID, WI, IL, CA, WA, OR, CO, AK, ID, AK, MO, KS, NE",OH,Chicken Street Taco kit in a plastic tray with a clear plastic lid.,20210616,Class I,{},The Kroger Co,F-0678-2021,E-Mail,Food,88012,20210621,20210522,45202-1141,Voluntary: Firm initiated,Terminated,,2021-06-16
United States,Wittenberg,203 N Genesee St,"Coffee cake may contain undeclared wheat, egg, and milk.",,18 units,Code printed on top of white box:  0205 and 0337  Code printed on Pint Label 21005,20210127,"AR, CA, CO, CT, IA, IL, IN, KY, MD, MI, NC, NE, NM, NV, OH, OK, PA, TN, TX, VT, WA, WI, WY.",WI,"Blueberry Blizzard Coffee Cake,  Item 259, Net Wt. 24 oz.",20210203,Class II,{},"Nueske Applewood Smoked Meat, Inc",F-0240-2021,Telephone,Food,87191,20210319,20210118,54499-9154,Voluntary: Firm initiated,Terminated,,2021-02-03
United States,Seattle,4301 University Way Ne,Ice cream grab n go Pint containers' labels do not declare any ingredients including allergens Egg and Milk.,,15 pints,No manufacturing code & expiration dates range from 7/30/2023 to 8/21/2023.,20230808,Distributed in WA only.,WA,"Sweet Alchemy Strawberry ice cream, distributed in pints.  Label declares company name, flavor name, but does not declare ingredients and allergens.",20230816,Class II,{},"Sweet Alchemy Ice Creamery, Inc",F-1388-2023,E-Mail,Food,92649,20230911,20230630,98105-5808,Voluntary: Firm initiated,Terminated,,2023-08-16
United States,Miami,1864 Nw 22nd St,"Undeclared Egg, Yellow #5, Red #40, and Blue #1.",,2566 gallons,Production dates from 9/10/20 through 9/1/21.,20210930,Domestic distribution only.,FL,"Vanilla Flavor Imitation (White), Net Contents 128 FL. OZS. (1 Gallon)",20211006,Class I,{},"Medina Baking and Powder Products, Inc.",F-1027-2021,Visit,Food,88663,20220211,20210909,33142-7444,Voluntary: Firm initiated,Terminated,,2021-10-06
United States,Rock Valley,1438 Main St,Bakery products which contain an ingredient which contain egg do not declare egg on the label,,9 retail packages,None.,20170426,Product distributed to northwest Iowa and southeast South Dakota,IA,"Sno-Flake Buns, Valley Bakery, Rock Valley, IA, 12 count. UPC 290713203606, packaged in clear plastic bags",20170503,Class I,{},Valley Bakery Wholesalers Inc,F-2119-2017,Telephone,Food,76764,20170717,20170318,51247-1224,Voluntary: Firm initiated,Terminated,,2017-05-03
United States,Gardena,1650 W El Segundo Blvd,Undeclared allergen; egg.,,"1,594,338 units",BEST BEFORE JAN.15.2019 to BEST BEFORE NOV.21.2019,20190222,"U.S. distribution to the following: CA, WA, UT, IL, TX, NJ, GA, NV, CO, HI, OR, AZ    Foreign distribution to the following: Canada",CA,"Ottogi BuckwheatChilli Noodle PK  1lb 6.93oz x 8pk  Item #32143061  Manufactured by: Ottogi Ramyon Co. Ltd.  Distributed by: Ottogi America, Inc. 1650 W. El Segundo Bl. Gardena, CA 90249",20190306,Class I,{},Ottogi America Inc,F-1073-2019,Letter,Food,81944,20190426,20190115,90249-2010,Voluntary: Firm initiated,Terminated,,2019-03-06
United States,Sterling,22445 Sous Vide Ln,Undeclared egg and milk,,780 cases,"82541, 83232, and 83369",20210625,Distributed nationwide,VA,"JUST Egg Inspired by India Curry, Broccoli, Cauliflower, Coconut Milk, Lemongrass 4 Sous Vide Plant Egg Bites NET WT8.4OZ (238g). UPC: 0504402511, Expiration dates 3/5/2022, 3/31/2022, and 4/9/2022.16 cartons per corrugated case, Carton GTIN 7 05044 02511 7  Case Bar Code 10 7050 440 25114",20210707,Class II,{},Cuisine Solutions,F-0745-2021,E-Mail,Food,88143,20220330,20210618,20166-9382,Voluntary: Firm initiated,Terminated,,2021-07-07
United States,Oak Brook,2021 Spring Rd Ste 500,Undeclared allergen: Egg.,,36 cases (4 X 1 GL),Best By: 03/04/16    /81E11055,20160404,FL,IL,"Crispers Honey Lime Dressing, 1 GL, Distributed by Bay Valley Foods, LLC, Oak Brook, IL 60523",20160413,Class I,{},Bay Valley Foods,F-1024-2016,"Two or more of the following: Email, Fax, Letter, Press Release, Telephone, Visit",Food,72771,20160411,20151202,60523-1859,Voluntary: Firm initiated,Terminated,,2016-04-13
