country,city,address_1,reason_for_recall,address_2,product_quantity,code_info,center_classification_date,distribution_pattern,state,product_description,report_date,classification,openfda,recalling_firm,recall_number,initial_firm_notification,product_type,event_id,termination_date,recall_initiation_date,postal_code,voluntary_mandated,status,more_code_info,datetime_report_date
United States,Cincinnati,100 Lock St,"The chicken bacon, egg white and cheese on flat bread sandwich was manufactured using a raw chicken bacon.",,79 cases/24 per case,180308,20180426,Product was only distributed to one customer in the Kentucky.,OH,"Chicken bacon, egg white and cheese on flat bread sandwich",20180425,Class II,{},"Premier Food Management, LLC",F-1139-2018,Telephone,Food,79732,20180614,20180313,45215-4639,Voluntary: Firm initiated,Terminated,,2018-04-25
United States,Seattle,2450 6th Ave S #200,Royal Asia brand Shrimp Wonton Noodle Soup is recalled due to undeclared egg.,,7793 cases (9 cartons per case and 6 bowls per cartons),Best by dates:  from 12/12/2018 to 8/8/2019.,20171012,"AK, ID, MT, OR, UT, and WA",WA,"Costco item # 1052939, Royal Asia brand Shrimp Wonton Noodle Soup, 6 bowls per case. Net weight 3.94lb (1.79kg) 63oz.  UPC 8 77971 00536 1.      The label is read in parts: ""Royal Asia Shrimp Wonton Noodle Soup***INGREDIENTS: WONTON NOODLE (WHEAT FLOUR, WATER, SALT), SHRIMP WONTON (SHRIMP (FARM RAISED), WONTON SKIN (WATER, WHEAT, VEGETABLE OIL, SALT), SUGAR, SALT, ONION, SESAME OIL, VEGETABLE OIL, PEPPER), SOUP BASE (WATER, SALT, SUGAR, ONION, GARLIC, VEGETABLE OIL, SOY SAUCE (WATER, WHEAT, SOY, SALT, PEPPER), CHINESE CABBAGE***PRODUCT OF VIETNAM***Tai Foong USA***Seattle, WA***www.northernchef.com***"".",20171018,Class I,{},Tai Foong USA Inc,F-0023-2018,"Two or more of the following: Email, Fax, Letter, Press Release, Telephone, Visit",Food,78199,20171215,20170929,98134-2029,Voluntary: Firm initiated,Terminated,,2017-10-18
United States,Seattle,4301 University Way Ne,Ice cream grab n go Pint containers' labels do not declare any ingredients including allergens Egg and Milk.,,12 pints,No manufacturing code & expiration dates range from 7/30/2023 to 8/21/2023.,20230808,Distributed in WA only.,WA,"Sweet Alchemy UW Honey ice cream, distributed in pints. Label declares company name, flavor name, but does not declare ingredients and allergens.",20230816,Class II,{},"Sweet Alchemy Ice Creamery, Inc",F-1392-2023,E-Mail,Food,92649,20230911,20230630,98105-5808,Voluntary: Firm initiated,Terminated,,2023-08-16
United States,Bethesda,6905 Rockledge Dr,"Tarragon Chicken Salad Sandwich label declares Mayonnaise and Bread, but label does NOT declare Egg and Wheat.",,57 units,Expiration date: 5/3/23.,20230523,distributed in WA.,MD,"House Made Tarragon Chicken Salad Sandwich, brand DishD'Lish.  The label declares House Roasted Chicken Breast, Herbs, Fresh Tarragon, Arugula, Mayonnaise, and Whole Grain Bread.",20230531,Class I,{},Hms Host International Inc,F-0933-2023,Other,Food,92280,20230525,20230503,20817-1828,Voluntary: Firm initiated,Terminated,,2023-05-31
United States,Vernon,2100 E 49th St,One specific lot of Trader Joe's Butternut Squash & Creamed Spinach Gratin due to undeclared wheat and egg.,,"3,270 units",SKU 96541.  USE BY 12/13/13.  LOT 235211.,20131213,"Trader Joe's stores in Southern California, Utah, Southern Nevada and Texas.",CA,"Trader Joe's Butternut Squash & Creamed Spinach Gratin, 16 oz.",20131225,Class I,{},Huxtable's Kitchen Inc,F-0827-2014,"Two or more of the following: Email, Fax, Letter, Press Release, Telephone, Visit",Food,66984,20140505,20131202,90058-2825,Voluntary: Firm initiated,Terminated,,2013-12-25
United States,Houston,2777 Allen Pkwy,Undeclared egg.,,"17,356 cases of 12 each",Six date codes: Best if Used by: MAR 30 22H; MAR 31 22H; JUN 04 22H; JUN 05 22H; JUL 24 22H; JUL 25 22H.,20200902,"IL, TX, FL, CA, PA",TX,RONZONI SINCE 1915 Smart Taste Extra Wide Noodle Style 2.5x the Fiber of Regular Pasta Net Wt. 12OZ (340g). UPC: 7130005008,20200909,Class I,{},Riviana Foods Inc,F-1419-2020,"Two or more of the following: Email, Fax, Letter, Press Release, Telephone, Visit",Food,86326,20211208,20200820,77019-2141,Voluntary: Firm initiated,Terminated,,2020-09-09
United States,Leavenworth,10171 Chumstick Hwy,"Undeclared Wheat, Milk, Egg, Soy, or Sesame on retail packaged bread products due to no ingredient statements.",,6 units,None.,20220107,Distributed in WA only.,WA,"Sourdough Bread, Bosket Bread brand.  The Net weight of the products range from 1-1.5 lbs. No UPC.    Product is packaged in food grade plastic bag with the black Bosket Bread logo sticker on the front,  but without the ingredients statement affixed on a package.",20220119,Class II,{},"Bosket Bread Company, LLC",F-0381-2022,Telephone,Food,89251,20220110,20211216,98826-8762,Voluntary: Firm initiated,Terminated,,2022-01-19
United States,Austin,550 Bowie St,Potential to contain undeclared egg,,580.91units (total of all products),Best by dates through 10/28/2020,20201124,"Maryland, New Jersey, Pennsylvania, Virginia and Washington, D.C.",TX,"Rotisserie Chicken Meals with Mac & Cheese and Broccoli, packaged in clear plastic container with printed label product code begins with 261596  261580, 261590, 261601, 261608, or 261616",20201202,Class I,{},Whole Foods Market,F-0131-2021,"Two or more of the following: Email, Fax, Letter, Press Release, Telephone, Visit",Food,86682,20201204,20201027,78703-4644,Voluntary: Firm initiated,Terminated,,2020-12-02
United States,Fife,7214 26th St E C-102,"The Ingredients statement declared wheat, egg, and milk but the Contains statement declared only wheat.",,476 packages,"Best before: February 1, 2017 and including up to August 10, 2017",20170329,"California, Oregon, and Washington",WA,"COOKIES FANTAZIA, product is packaged in plastic clamshells container, Net Weight: 454g (16 OZ), UPC: UPC: 8 51929 00361 6   	  The label is read in parts: ""***COOKIES ""FANTAZIA"" *** INGREDIENTS: WHEAT FLOUR (WHEAT FLOUR, NIACIN, REDUCE IRON, THIAMINE MONONITRATE, RIBOFLAVIN, FOLIC ACID, BUTTER (PASTERIZED CREAM, NATURAL FLAVORINGS, MILK, EGGS, SUGAR*** Contains: Wheat***"".",20170405,Class II,{},Kusher LLC,F-1787-2017,Letter,Food,76538,20180723,20170219,98424-3773,Voluntary: Firm initiated,Terminated,,2017-04-05
United States,Grand Rapids,2929 Walker Ave Nw,salads and sandwiches contain a sourced cooked egg ingredient which tested positive for Salmonella by the supplier.,,4131 units,"UPC:  7-08820-54345-4     Sold in Meijer stores from 7/20/16 to 7/25/16  code dates: 7/25/16, 7/26/16, 7/27/16, 7/29/16",20160914,"IL, IN, KY, MI, OH, WI",MI,MARKETS OF MEIJER EGG SALAD SANDWICH  8 OZ EA   individual packaged sandwich,20160921,Class I,{},"Meijer Distribution, Inc",F-2160-2016,E-Mail,Food,74804,20161028,20160725,49544-6402,Voluntary: Firm initiated,Terminated,,2016-09-21
United States,Camarillo,1320 Flynn Rd Ste B,Undeclared allergen; egg,,,Firm does not generate manufacturing codes,20231030,U.S. customers can order scones directly from firm's website. The firm distributes to customers in CA and NV.,CA,"Fine Sconehenge Baking Company, ENGLISH SCONE, individually sealed plastic bag",20231108,Class I,{},"The Kitchen Garden Co, LLC",F-0310-2024,"Two or more of the following: Email, Fax, Letter, Press Release, Telephone, Visit",Food,93148,,20230912,93012-8744,Voluntary: Firm initiated,Ongoing,,2023-11-08
United States,Chicago,5569 W. Northwest Highway,"Undeclared Allergens - Egg, Milk, and Wheat",,22,UPC 84104900589,20220309,Retail locations in IL and WI,IL,Chicago Sweet Connections: Coffee Cake - Cheese Flavor packaged in an aluminum rectangular tray with plastic dome lid Single pack - 6 servings,20220316,Class II,{},"Chicago Sweet Connections, Inc.",F-0844-2022,"Two or more of the following: Email, Fax, Letter, Press Release, Telephone, Visit",Food,89679,20220318,20220225,60630,Voluntary: Firm initiated,Terminated,,2022-03-16
United States,Portland,1703 Nw 16th Ave Ste B,Undeclared egg.  Label declares Mayo but does not declare Egg.,,15 - 1 gallon containers,The product with a date prior to  APR 14 2022  is recalled.,20220520,Distributed in Oregon and Washington,OR,"Mio Salad Dressing packaged in 1 gallon plastic jug.  Label read in parts: ""Ingredient: Onion, Carrot, Ginger water, Soybean oil, Reg. Vinegar, Mayo, Sushi Ginger"".",20220601,Class I,{},Joonsung Trading Inc,F-1078-2022,Telephone,Food,90040,20220614,20220414,97209-2505,Voluntary: Firm initiated,Terminated,,2022-06-01
United States,Houston,333 Northpark Central Dr,Undeclared egg,,3517 units,"Lot# 073437, 073447, 073457, 073467, 073477; UPC # 710779112834",20180508,"Distributed nationwide throughout the US and the following countries - Vietnam,   Dom Republic, Kuwait, Panama, Saudi, Korea, Germany, Iceland, EU, Bermuda, Australia, Jordan",TX,"Lean Pro 8 Vanilla 2,268g (5lb) Tub",20180516,Class I,{},"Labrada Nutrition, Inc",F-1391-2018,"Two or more of the following: Email, Fax, Letter, Press Release, Telephone, Visit",Food,79958,20181019,20180424,77073-6336,Voluntary: Firm initiated,Terminated,,2018-05-16
United States,Gordonville,4021B Old Philadelphia Pike,"Product labeling fails to declare allergens (egg, soybean oil) contained in mayonnaise used as ingredients",,Unknown,"All product with use by date up to and including September 13, 2012",20120928,Distribution within the US to PA.,PA,"Sadie's Salads Cole Slaw, 5 lb, 10 lb and 30 lb plastic tubs",20121010,Class I,{},Sadie's Salads,F-1074-2012,Telephone,Food,63055,20131018,20120828,17529-9769,Voluntary: Firm initiated,Terminated,,2012-10-10
United States,Kansas City,1 E Armour Blvd,"The product ingredients statement declares egg ingredients, but the ""Contains"" statement fails to declare egg.",,"18,065 cases","F052123000, Best by July 25, 2018; F061123000, Best by August 15, 2018; F071623000, Best by Sept. 16, 2018; F072323000, Best by Sept. 26, 2018",20180827,Distributed nationwide.,MO,Hostess Brownies Cookies 'n Cr¿me packaged in the following ways: 1) 6 Brownies individually wrapped packaged in a cardboard box Net Wt. 8.68 OZ (246 g) UPC 888109113575; 2) 2 Brownies packaged in a cardboard box Net Wt. 2.89 OZ (82 g) UPC 888109012021,20180905,Class II,{},"Hostess Brands, LLC",F-1901-2018,"Two or more of the following: Email, Fax, Letter, Press Release, Telephone, Visit",Food,80725,20181218,20180803,64111-1201,Voluntary: Firm initiated,Terminated,,2018-09-05
United States,Sunbury,1000 S 2nd St,Undeclared egg,,total = 1814 containers & 2045 cases,All lots,20230928,"Retail locations in the following states: DE, MD, NJ, NY, PA, VA, WV",PA,Weis Quality Brownie Moose Tracks Ice Cream (48oz)UPC of 041497-01194 Packaged in a scround container. 6 units per case.,20231004,Class I,{},"Weis Markets, Inc., Ice Cream Division",F-1617-2023,E-Mail,Food,92972,20230929,20230830,17801-3318,Voluntary: Firm initiated,Terminated,,2023-10-04
United States,Rock Valley,1438 Main St,Bakery products which contain an ingredient which contain egg do not declare egg on the label,,12 retail packages,None.,20170426,Product distributed to northwest Iowa and southeast South Dakota,IA,"Wheat Hamburger Buns, Valley Bakery, Rock Valley, IA, 12 count. UPC 290218903907, packaged in clear plastic bags",20170503,Class I,{},Valley Bakery Wholesalers Inc,F-2115-2017,Telephone,Food,76764,20170717,20170318,51247-1224,Voluntary: Firm initiated,Terminated,,2017-05-03
United States,Moonachie,25 Knickerbocker Rd,Fish products contain undeclared egg and wheat.,,4 cases,Expiration date 03/06/2019,20171214,"NY, NJ, PA, MA, ME, VA, MD, DE, CT, RI, and NH",NJ,"Fish Cake in Polybag 10/930g, Item no. 15731  UPC Code 087703157316",20171220,Class I,{},Wang Globalnet,F-0492-2018,Letter,Food,77241,20180123,20170515,07074-1613,Voluntary: Firm initiated,Terminated,,2017-12-20
United States,Gardena,1650 W El Segundo Blvd,Undeclared allergen; egg.,,"1,594,338 units",BEST BEFORE JAN.15.2019 to BEST BEFORE NOV.21.2019,20190222,"U.S. distribution to the following: CA, WA, UT, IL, TX, NJ, GA, NV, CO, HI, OR, AZ    Foreign distribution to the following: Canada",CA,"Ottogi Snack Ramen 5PK, Cup  1lb 3.05oz x 8pk, 2.18oz x 6ea  Item #21501281, 21502161  Manufactured by: Ottogi Ramyon Co. Ltd.  Distributed by: Ottogi America, Inc. 1650 W. El Segundo Bl. Gardena, CA 90249",20190306,Class I,{},Ottogi America Inc,F-1063-2019,Letter,Food,81944,20190426,20190115,90249-2010,Voluntary: Firm initiated,Terminated,,2019-03-06
United States,Kent,"23444 30th Ave S., Space #104","Butter Creek Farms, Inc. is recalling Chocolate Chip Cookies (Cow Chip, Calf Chip and Bull Chip) due to undeclared Wheat, Soy, Egg, Milk (butter is listed). The firm sold single product or combined this product with other products in gift boxes from the website http://cowchipcookies.com/index.htm.",,unknown,none,20140331,sold to internet customers from the website cowchipcookies.com and  at two retail stores owned by recalling firm in WA.,WA,"Cow Chip, Calf Chip and Bull Chip are Chocolate Chip Cookies",20140409,Class I,{},"Butter Creek Farms, Inc.",F-1732-2014,"Two or more of the following: Email, Fax, Letter, Press Release, Telephone, Visit",Food,67300,20140924,20131231,98032-2807,Voluntary: Firm initiated,Terminated,,2014-04-09
United States,Brooklyn,1300 Metropolitan Ave,"Product may contain undeclared egg,",,300 cases,All lots within expiry.,20170619,NY,NY,"Master Carton is Labeled As: LOBSTER FLAVORED BALL DISTRIBUTED EXCLUSIVELY BY: H & C FOOD INC. BROOKLYN, NY 11237 KEEP FROZEN AT -18 C",20170628,Class I,{},H & C Food Inc,F-2381-2017,Telephone,Food,77328,20181012,20170522,11237-1104,Voluntary: Firm initiated,Terminated,,2017-06-28
United States,Moonachie,25 Knickerbocker Rd,Fish products contain undeclared egg and wheat.,,5 cases,Expiration date 03/09/2019,20171214,"NY, NJ, PA, MA, ME, VA, MD, DE, CT, RI, and NH",NJ,"Fish Cake in Polybag 20/1lb., Item no. 13125 UPC Code 087703131256",20171220,Class I,{},Wang Globalnet,F-0488-2018,Letter,Food,77241,20180123,20170515,07074-1613,Voluntary: Firm initiated,Terminated,,2017-12-20
United States,Leavenworth,10171 Chumstick Hwy,"Undeclared Wheat, Milk, Egg, Soy, or Sesame on retail packaged bread products due to no ingredient statements.",,2 units.,None.,20220107,Distributed in WA only.,WA,"8 Grain Bread, Bosket Bread brand.  The Net weight of the products range from 1-1.5 lbs. No UPC.    Product is packaged in food grade plastic bag with the black Bosket Bread logo sticker on the front,  but without the ingredients statement affixed on a package.",20220119,Class II,{},"Bosket Bread Company, LLC",F-0367-2022,Telephone,Food,89251,20220110,20211216,98826-8762,Voluntary: Firm initiated,Terminated,,2022-01-19
United States,West Monroe,131 Frost Commerical Dr,Pre-portioned sugar cookie dough contains undeclared milk and pre-portioned walnut chocolate chunk cookie dough contains undeclared egg.,,3231 units,Dates codes:  10/9/15  11/23/15 (Julian Dates - 15282  - 15327),20160104,Nationwide,LA,Crazy about Cookies 2lb Monster Bash COLLECTION Decorated SUGAR COOKIE KIT Item # 03-4032 UPC Code - 698768034322,20160113,Class I,{},Pine Valley Foods Inc,F-0429-2016,"Two or more of the following: Email, Fax, Letter, Press Release, Telephone, Visit",Food,72831,20170803,20151210,71292-2479,Voluntary: Firm initiated,Terminated,,2016-01-13
United States,Brooklyn,1300 Metropolitan Ave,Product contains undeclared allergens egg and crustacean.,,Unknown,Product is not coded.,20181001,NY,NY,"Fish Balls, packaged in a red and white plastic bag with gold font, NET WT: 14OZ (400g), UPC: 6 953006 4 50093. Keep Frozen.",20180919,Class I,{},H & C Food Inc.,F-0003-2019,"Two or more of the following: Email, Fax, Letter, Press Release, Telephone, Visit",Food,80948,20191114,20180904,11237-1104,Voluntary: Firm initiated,Terminated,,2018-09-19
United States,Pittsburgh,101 Kappa Dr,GetGo from Giant Eagle Voluntarily Recalls Select Grab-and-Go Subs Due to Undeclared Egg Allergen,,4671 units,Sell By: (up to and including) 04/02/15  UPC: 25567 20399,20150422,MD OH PA WV,PA,"GetGo GNG 7 Inch Italian Sub Sell By: (up to and including) 04/02/15  Net Wt: 6.0 Oz.  Contains: Soy, Milk, Wheat  UPC: 25567 20399  GetGo from Giant Eagle  Distributed by Giant Eagle, Inc., Pittsburgh, PA 15238    Sandwich is wrapped in plastic.",20150429,Class I,{},"Giant Eagle, Inc.",F-2024-2015,E-Mail,Food,70883,20150527,20150331,15238-2809,Voluntary: Firm initiated,Terminated,,2015-04-29
United States,Los Angeles,1700 N Soto St,AI Foods is recalling egg roll skins due to undeclared wheat.,,26 units,All,20150409,"US: CA, WA, CO, NV, TX, AZ, IL, HI.",CA,"Cheesetix (Cheese Lumpia) 12.6 oz, 20 units/case, UPC 0 30283 16542 4",20150415,Class II,{},A I Foods Corporation,F-1936-2015,"Two or more of the following: Email, Fax, Letter, Press Release, Telephone, Visit",Food,70776,20150724,20150318,90033-1127,Voluntary: Firm initiated,Terminated,,2015-04-15
United States,Gardena,1650 W El Segundo Blvd,Undeclared allergen; egg.,,"1,594,338 units",BEST BEFORE JAN.15.2019 to BEST BEFORE NOV.21.2019,20190222,"U.S. distribution to the following: CA, WA, UT, IL, TX, NJ, GA, NV, CO, HI, OR, AZ    Foreign distribution to the following: Canada",CA,"Ottogi Yeul Ramen (Bowl)  4.06oz x 12ea  Item #21305007  Manufactured by: Ottogi Ramyon Co. Ltd.  Distributed by: Ottogi America, Inc. 1650 W. El Segundo Bl. Gardena, CA 90249",20190306,Class I,{},Ottogi America Inc,F-1059-2019,Letter,Food,81944,20190426,20190115,90249-2010,Voluntary: Firm initiated,Terminated,,2019-03-06
United States,Salinas,1250 Hansen St,"Mann Packing was notified by a customer that the incorrect bottom label is on their Organic Veggie Tray with Best By date of January 14, 2017 and does not declare the allergens of egg, milk, soy and mustard.",,201 cases (4 trays per case),"Best if Used by: January 14, 2017;  Lot Serial # 3658366",20170202,"MN, NY, FL, IA, TX.",CA,"Snacking Favorites Organic Veggies with Organic Ranch Dip.    16.25 oz. plastic tray (1.02 lb.)                  UPC barcode: 71651901471 - this is the incorrect barcode that is on the bottom of recalled product.  Correct UPC: 716519014765    Incorrect Allergen Statement: Egg. Milk  Correct Allergen Statement, Egg, Milk, Soy and Mustard.",20170208,Class I,{},"Mann Packing Company, Inc.",F-1432-2017,"Two or more of the following: Email, Fax, Letter, Press Release, Telephone, Visit",Food,76207,20170215,20170110,93901-4552,Voluntary: Firm initiated,Terminated,,2017-02-08
United States,Moonachie,25 Knickerbocker Rd,Fish products contain undeclared egg and wheat.,,2 cases,Expiration date: 03/15/2019,20171214,"NY, NJ, PA, MA, ME, VA, MD, DE, CT, RI, and NH",NJ,"Fish Ball in Polybag 24/12oz., Item no. 20072, UPC Code 087703200722",20171220,Class I,{},Wang Globalnet,F-0489-2018,Letter,Food,77241,20180123,20170515,07074-1613,Voluntary: Firm initiated,Terminated,,2017-12-20
United States,Pittsburgh,101 Kappa Dr,Products contain undeclared egg.,,625 packages,Sell By: (up to and including) 3/28/15;   PLU: 97754,20150424,"MD, OH, PA, WV",PA,"BOLILLO WHEAT ROLL;   PLU: 97754;  NET WT: 14oz.;  Contains: Wheat, Soy",20150506,Class I,{},"Giant Eagle, Inc.",F-2036-2015,E-Mail,Food,70871,20150527,20150326,15238-2809,Voluntary: Firm initiated,Terminated,,2015-05-06
United States,Fall River,630 Currant Rd,Lobster bisque contains undeclared noodle with egg ingredient.,,"17,992 units (2,987 cases)",Lot/Unit Numbers: 030821-11K. Expiration date(s) or Use by Date(s) or expected shelf life of product: USE BY:05/17/2021 UPC Codes: 077958690300,20210510,"CA, CO, GA, IL, IN, KS, MA, MD, MI, MO, NC, NE, NJ, OK, OR, PA, TX, VA, WA, WI.",MA,"Panera Lobster Bisque, 16 oz.",20210519,Class II,{},Blount Fine Foods Corporation,F-0486-2021,E-Mail,Food,87725,20220111,20210414,02720-4713,Voluntary: Firm initiated,Terminated,,2021-05-19
United States,New Berlin,2400 S Calhoun Rd,Banana Puddin Base contains an undeclared egg sub-ingredient.,,"6,096 lbs.","Lot F016758, Exp 03/03/2019;     Lot F017544, Exp 03/30/2019;     Lot F021031, Exp 11/06/2019;     Lot F021997 Exp 12/22/2019;",20190423,"OH, PA",WI,"Banana Puddin Base, item # 70 0559-1034, in 5 gallon plastic pail.  Net Wt:  48 LBS.  Ice Cream Flavoring.  Store Refrigerated (35-45F) at all times.  Denali Ingredients LLC, 2400 S. Calhoun Rd, New Berlin, WI  53151",20190501,Class I,{},Denali Ingredients LLC,F-1304-2019,Telephone,Food,82649,20190627,20190416,53151-2710,Voluntary: Firm initiated,Terminated,,2019-05-01
United States,Pittsburgh,101 Kappa Dr,Little Italy Panini contains Undeclared  Egg.,,66 units,COLD: up to and including Sell By: 3/24/2015.  PLU: 97525;   HOT: up to and including Sell By 3/22/2015  Immediate consumption. PLU #: 7369,20150409,PA,PA,"Packed in rigid plastic clam shell container:  Giant Eagle Little Italy Panini Cold; Sell By: (all dates up to and including) 3/24/2015; PLU #97525; Net Wt 13oz; Contains Wheat, Milk, Fish (Anchovy); Keep Refrigerated  ;  Giant Eagle Little Italy Panini Hot; Sell By: (all dates up to and including) 3/22/2015; PLU: 7369; Net Wt 16oz; Contains Wheat, Milk, Fish (Anchovy).",20150415,Class I,{},"Giant Eagle, Inc.",F-1931-2015,"Two or more of the following: Email, Fax, Letter, Press Release, Telephone, Visit",Food,70803,20150727,20150322,15238-2809,Voluntary: Firm initiated,Terminated,,2015-04-15
United States,Los Angeles,1700 N Soto St,AI Foods is recalling egg roll skins due to undeclared wheat.,,47 units,All,20150409,"US: CA, WA, CO, NV, TX, AZ, IL, HI.",CA,"Seafood Eggroll Lumpiang Shanghai, Reg. Size 34 oz, 9 units/case, UPC 7 95981 09175 7",20150415,Class II,{},A I Foods Corporation,F-1938-2015,"Two or more of the following: Email, Fax, Letter, Press Release, Telephone, Visit",Food,70776,20150724,20150318,90033-1127,Voluntary: Firm initiated,Terminated,,2015-04-15
United States,Brooklyn,220 36th St,Product contains undeclared egg.,Unit 22,415 cases,Best By: 10/27/19; 10/29/19; 12/04/19; 01/25/20; 01/26/20; 01/28/20 (stamped on the side),20181030,"CA, CO, IL, IN, PA, TX",NY,"feel good foods VEGETABLE FRIED RICE NET WT 9 OZ (255G), UPC: 8 99039 00212 9. Frozen.",20181107,Class I,{},Feel Good Foods Inc,F-0339-2019,E-Mail,Food,81286,20190205,20181011,11232-2545,Voluntary: Firm initiated,Terminated,,2018-11-07
United States,Seattle,4301 University Way Ne,"Ice cream grab n go Pint containers' labels do not declare any ingredients including allergens Egg, Milk, and Wheat.",,12 pints,No manufacturing code & expiration dates range from 7/30/2023 to 8/21/2023.,20230808,Distributed in WA only.,WA,"Sweet Alchemy Strawberry Rhubarb Crumble ice cream, distributed in pints. Label declares company name, flavor name, but does not declare ingredients and allergens.",20230816,Class II,{},"Sweet Alchemy Ice Creamery, Inc",F-1389-2023,E-Mail,Food,92649,20230911,20230630,98105-5808,Voluntary: Firm initiated,Terminated,,2023-08-16
United States,Grand Rapids,2929 Walker Ave Nw,salads and sandwiches contain a sourced cooked egg ingredient which tested positive for Salmonella by the supplier.,,3071 units,"UPC:  7-08820-52935-9    Sold in Meijer stores from 7/20/16 to 7/25/16  code dates: 7/25/16, 7/26/16, 7/27/16",20160914,"IL, IN, KY, MI, OH, WI",MI,MARKETS OF MEIJER TUNA SALAD SANDWICH WEDGE   7 OZ EA  individual packaged sandwich,20160921,Class I,{},"Meijer Distribution, Inc",F-2159-2016,E-Mail,Food,74804,20161028,20160725,49544-6402,Voluntary: Firm initiated,Terminated,,2016-09-21
United States,Brisbane,201 S Hill Dr,Undeclared allergen; egg.,,,All dates within expiry.,20231017,"U.S. distribution to the following: CA, IL, TX, GA, WA, and NJ  No foreign distribution.",CA,Small 12- Tea Flavor Assorted Mooncake Gift Box,20231025,Class I,{},"Sheng Kee of California, Inc dba Sheng Kee Bakery",F-0290-2024,Telephone,Food,92989,,20230901,94005-1204,Voluntary: Firm initiated,Ongoing,,2023-10-25
United States,Austin,601 N Lamar Blvd Ste 300,Whole and sliced Apple and Cherry Pies from five stores in the Mid-Atlantic Region contain  undeclared milk and egg.,,548 pies (total),Sell by Dates : 9/202021-9/27/2021,20211019,"MD, PA, VA",TX,"Whole Foods Market Everyday Double Crust Cherry Pie sold in clear plastic clamshell with scale label applied. Sold as whole pie or by the slice. PLUs 74874, 74401, 33405",20211027,Class I,{},"Whole Foods Market Brand 365, Llc",F-0025-2022,"Two or more of the following: Email, Fax, Letter, Press Release, Telephone, Visit",Food,88765,20211208,20210922,78703-5424,Voluntary: Firm initiated,Terminated,,2021-10-27
United States,Hodgkins,6800 Santa Fe Dr,Eggs in RTE bacon and egg packet may contain Listeria Monocytogenes.,,"2516 cases, 6793.2 lbs.","USE BY"" dates 12/27/19, 1/3/20, 1/23/20, 1/30/20, 2/6/20, 2/14/20, 2/19/20 and 2/28/20 and lot codes 281191, 302191, 309191, 316191, 323191, 331191, 336191, 344191",20200116,"The firm distributed product to 4 distribution centers, Dot Foods, IL, S. Abrahams, MI, KINEX, NC, and Lipari Foods, MI.",IL,RTE bacon and eggs 3.6 oz package,20200122,Class I,{},Cheesewich Factory,F-0515-2020,"Two or more of the following: Email, Fax, Letter, Press Release, Telephone, Visit",Food,84641,20200520,20191227,60525-7639,Voluntary: Firm initiated,Terminated,,2020-01-22
United States,Austin,601 N Lamar Blvd Ste 300,Undeclared egg,,23 units,"Pack Date: 1/20/22, Sell By Date 2/19/22",20220302,Washington D.C.,TX,Whole Foods Market Vanilla Short Bread Cookies packaged in clear plastic container with a white scale label applied PLU 66705,20220309,Class I,{},"Whole Foods Market Brand 365, Llc",F-0806-2022,"Two or more of the following: Email, Fax, Letter, Press Release, Telephone, Visit",Food,89528,,20220203,78703-5424,Voluntary: Firm initiated,Ongoing,,2022-03-09
